### ISSUE TITLE
missing ClusterRole and ClusterRoleBinding for kube-cnc-router (2.2.1)

### ISSUE THREAD

**Issue by chralg** [citrix/citrix-k8s-node-controller#17]
Hi,

It seems that ClusterRole and ClusterRoleBinding is missing for service-account kube-cnc-router in kube-system namespace.

fix.

---
kind: ClusterRole
apiVersion: rbac.authorization.k8s.io/v1
metadata:
  name: kube-cnc-router
rules:
  - apiGroups: ["*"]
    resources: ["configmaps", "pods"]
    verbs: ["get", "list", "watch", "create", "patch", "delete", "update"]
  - apiGroups: [""]
    resources: ["configmaps", "pods"]
    verbs: ["get", "list", "watch", "create", "patch", "delete", "update"]
  - apiGroups: [""]
    resources: ["nodes"]
    verbs: ["get", "list", "watch", "patch"]
  - apiGroups: ["*"]
    resources: ["nodes"]
    verbs: ["get", "list", "watch", "patch"]
  - apiGroups: [""]
    resources: ["serviceaccounts", "clusterroles", "clusterrolebindings", "namespaces"]
    verbs: ["get", "list", "create", "delete"]
  - apiGroups: ["*"]
    resources: ["serviceaccounts", "clusterroles", "clusterrolebindings", "namespaces"]
    verbs: ["get", "list", "create", "delete"]
  - apiGroups: ["crd.projectcalico.org"]
    resources: ["ipamblocks"]
    verbs: ["get", "list"]
---
kind: ClusterRoleBinding
apiVersion: rbac.authorization.k8s.io/v1
metadata:
  name: kube-cnc-router
roleRef:
  apiGroup: rbac.authorization.k8s.io
  kind: ClusterRole
  name: kube-cnc-router
subjects:
- kind: ServiceAccount
  name: kube-cnc-router
  namespace: kube-system
apiVersion: rbac.authorization.k8s.io/v1

**Comment by aroraharsh23** [comment]
Clusterrole and cluster role bindings for kube-cnc-router need not be specified explicitly. These are created by the CNC app itself. Is your kube-system namespace not configurable? 
If it is configurable, could you share CNC logs?

**Comment by chralg** [comment]
Yes, kube-system's namespace configurable.

kubectl -n kube-system logs kube-cnc-router-00e50d1a-f709-4538-b247-17dcc6526a60 
CNI Name is cilium 
Error from server (Forbidden): configmaps "kube-cnc-router" is forbidden: User "system:serviceaccount:kube-system:kube-cnc-router" cannot get resource "configmaps" in API group "" in the namespace "kube-system"
Host Interface ens192
CNI Interface cilium_host
ip link add routervxlan0 type vxlan id 20  dev ens192  dstport 8500
ip addr add 10.240.0.8/24 dev routervxlan0
InterfaceInfo aa:aa:aa:3b:1a:16
IP Addredd 10.240.0.8
Host IP Address 10.1.0.43
CNI IP Address 10.244.3.152
CNI IP Prefix /24
CNI Addr 10.244.3.152/24
Error from server (Forbidden): configmaps "kube-cnc-router" is forbidden: User "system:serviceaccount:kube-system:kube-cnc-router" cannot get resource "configmaps" in API group "" in the namespace "kube-system"
Error from server (Forbidden): configmaps "kube-cnc-router" is forbidden: User "system:serviceaccount:kube-system:kube-cnc-router" cannot get resource "configmaps" in API group "" in the namespace "kube-system"
Error from server (Forbidden): configmaps "kube-cnc-router" is forbidden: User "system:serviceaccount:kube-system:kube-cnc-router" cannot get resource "configmaps" in API group "" in the namespace "kube-system"
Error from server (Forbidden): configmaps "kube-cnc-router" is forbidden: User "system:serviceaccount:kube-system:kube-cnc-router" cannot get resource "configmaps" in API group "" in the namespace "kube-system"
Error from server (Forbidden): configmaps "kube-cnc-router" is forbidden: User "system:serviceaccount:kube-system:kube-cnc-router" cannot get resource "configmaps" in API group "" in the namespace "kube-system"

**Comment by aroraharsh23** [comment]
Could you also share the logs for the CNC itself? 
We wanted to verify if there's any ERROR in creating the roles, rolebinding, sa for kube-cnc-router. 

On your Master, are you not getting any of deployments : 
root@master:~/harora/cnc# kubectl get serviceaccount -n kube-system| grep kube-cnc-router
kube-cnc-router                      1         3d20h
root@master:~/harora/cnc# kubectl get clusterrolebindings | grep kube-cnc-router
kube-cnc-router                                        ClusterRole/kube-cnc-router                                                        3d20h
root@master:~/harora/cnc# kubectl get clusterrole | grep kube-cnc-router
kube-cnc-router                                                        2021-01-29T06:31:26Z
root@master:~/harora/cnc#

**Comment by chralg** [comment]
Hi,

In the logs I find lines related to a documentation bug in the permissions section of ADC user creation in CNC deployment guide. For what I understand the regex doesn't match "\S+\s+bridgetable\s+\S+".

Last time I deployed using the helm chart. Serviceaccount matching release name gets created and is assigned clusterrole+binding in default namespace. Serviceaccount kube-cnc-router is created in kube-system, but get no clusterrole+binding in kube-system namespace, hence my fix.

I0201 20:56:20.227203       1 main.go:10] [INFO] Initializing Citrix Node Controller Version: 2.2.1
I0201 20:56:20.228459       1 create.go:69] [INFO] Creating Kube API Client
W0201 20:56:20.229032       1 client_config.go:549] Neither --kubeconfig nor --master was specified.  Using the inClusterConfig.  This might not work.
I0201 20:56:20.231835       1 create.go:87] [INFO] Kubernetes Client is created
I0201 20:56:20.231848       1 input.go:264] [INFO] Fetching all the input provided by User
I0201 20:56:20.231853       1 input.go:294] [INFO] Type (TYPE) is not provided, considering default TYPE as VXLAN
I0201 20:56:20.231861       1 input.go:225] [INFO] Initializing Kube Router
I0201 20:56:20.231872       1 input.go:258] [INFO] Host max is 10.240.0.255 and Remote IP is 10.240.0.254
I0201 20:56:20.231880       1 input.go:371] [INFO] Next Address 10.240.0.0
I0201 20:56:20.232110       1 create.go:365] [INFO] Creating RBAC for cnc router pods
I0201 20:56:20.272256       1 create.go:103] [INFO] Namespace selected is kube-system
I0201 20:56:20.272271       1 create.go:367] [INFO] namspace kube-system
I0201 20:56:20.272277       1 create.go:139] [INFO] Creating Cluster Roles
I0201 20:56:20.316647       1 create.go:179] [DEBUG] kube-cnc-router cluster role already exists
I0201 20:56:20.316660       1 create.go:189] [INFO] Creating Cluster Role Bindings
I0201 20:56:20.367409       1 create.go:211] [DEBUG] kube-cnc-router cluster rolebinding already exists
I0201 20:56:20.367421       1 create.go:108] [INFO] Creating Service Account
I0201 20:56:20.374862       1 create.go:119] [INFO] Service account selected is kube-cnc-router
I0201 20:56:20.374872       1 delete.go:55] [INFO] Clearing Stale pods and configmaps 
I0201 20:56:20.374875       1 delete.go:70] [INFO] Cleaning stale pods created by kube-cnc-router...
I0201 20:56:20.418721       1 delete.go:61] [INFO] Cleaning stale configmap created by kube-cnc-router...
I0201 20:56:20.432990       1 create.go:221] [INFO] Creating cnc router configmap and pods
I0201 20:56:20.433001       1 create.go:124] [INFO] Creating Configmap kube-cnc-router
I0201 20:56:20.456865       1 create.go:130] [INFO] Created Configmap kube-cnc-router is &ConfigMap{ObjectMeta:k8s_io_apimachinery_pkg_apis_meta_v1.ObjectMeta{Name:kube-cnc-router,GenerateName:,Namespace:kube-system,SelfLink:,UID:8a79cb05-73bc-43b3-840f-37de2956ef43,ResourceVersion:5909620,Generation:0,CreationTimestamp:2021-02-01 20:56:20 +0000 UTC,DeletionTimestamp:<nil>,DeletionGracePeriodSeconds:nil,Labels:map[string]string{},Annotations:map[string]string{},OwnerReferences:[],Finalizers:[],ClusterName:,Initializers:nil,ManagedFields:[{citrix-node-controller Update v1 2021-02-01 20:56:20 +0000 UTC nil}],},Data:map[string]string{EndpointIP: 10.240.0.254,Type: VXLAN,},BinaryData:map[string][]byte{},}
I0201 20:56:20.458098       1 watch.go:26] [INFO] Watching Node Events..
I0201 20:56:20.458118       1 k8sInterface.go:51] [INFO] Fetching Node Controller Input Values
I0201 20:56:20.458127       1 netScalerInterface.go:197] [INFO] Creating Nitro Client
I0201 20:56:20.463311       1 k8sInterface.go:179] [INFO] Received citrix-node-controller cmap add event
I0201 20:56:20.463336       1 create.go:386] [INFO] Verifying configmap created by kube-cnc-router...
I0201 20:56:20.466575       1 watch.go:47] [INFO] Received Node Add Event
I0201 20:56:20.467013       1 watch.go:47] [INFO] Received Node Add Event
I0201 20:56:20.467242       1 create.go:270] [INFO] In CreateKubeExtenderPod
I0201 20:56:20.467252       1 create.go:279] [INFO] Generating PODCIDR for Node with label used is Node-1596548f-7f27-4534-be75-735b8895bba4 
I0201 20:56:20.470021       1 k8sInterface.go:151] [INFO] CONFIG MAP ADD EVENT 
I0201 20:56:20.470034       1 netScalerInterface.go:259] [INFO] Adding SNIP Config
I0201 20:56:20.470042       1 netScalerInterface.go:413] [DEBUG] GO-NITRO: listing resource of type nsip, args:[ipaddress:10.240.0.254]
I0201 20:56:20.470048       1 netScalerInterface.go:419] [TRACE] GO-NITRO: url is https://10.2.0.254/nitro/v1/config/nsip?args=ipaddress:10.240.0.254
I0201 20:56:20.496211       1 create.go:284] [INFO] Updated node label Node-1596548f-7f27-4534-be75-735b8895bba4
I0201 20:56:20.496227       1 create.go:341] [INFO] Cleaning stale pods created by kube-cnc-router with pod name kube-cnc-router-1596548f-7f27-4534-be75-735b8895bba4
I0201 20:56:20.587993       1 netScalerInterface.go:149] [DEBUG] GO-NITRO: response Status:404 Not Found
I0201 20:56:20.588142       1 netScalerInterface.go:430] [DEBUG] GO-NITRO: read: Device Config not found
I0201 20:56:20.588242       1 netScalerInterface.go:175] [TRACE] GO-NITRO: Resourcejson is {"nsip":{"ipaddress":"10.240.0.254","netmask":"255.255.255.0"}}
I0201 20:56:20.588305       1 netScalerInterface.go:154] [DEBUG] GO-NITRO: Creating resource of type nsip
I0201 20:56:20.588347       1 netScalerInterface.go:161] [TRACE] GO-NITRO: url is https://10.2.0.254/nitro/v1/config/nsip
I0201 20:56:20.645467       1 create.go:354] [INFO] Creating a pod kube-cnc-router-1596548f-7f27-4534-be75-735b8895bba4
I0201 20:56:20.703900       1 netScalerInterface.go:149] [DEBUG] GO-NITRO: response Status:201 Created
I0201 20:56:20.703920       1 netScalerInterface.go:221] [INFO] Adding Vxlan Config
I0201 20:56:20.703923       1 netScalerInterface.go:223] [DEBUG] Removing if same Vxlan present in ADC
I0201 20:56:20.703926       1 netScalerInterface.go:250] [INFO] Deleting VXLAN Config
I0201 20:56:20.703934       1 netScalerInterface.go:413] [DEBUG] GO-NITRO: listing resource of type vxlan, args:[id:20]
I0201 20:56:20.703941       1 netScalerInterface.go:419] [TRACE] GO-NITRO: url is https://10.2.0.254/nitro/v1/config/vxlan?args=id:20
I0201 20:56:20.859379       1 watch.go:47] [INFO] Received Node Add Event
I0201 20:56:20.859636       1 create.go:270] [INFO] In CreateKubeExtenderPod
I0201 20:56:20.859654       1 create.go:279] [INFO] Generating PODCIDR for Node with label used is Node-e7f386e3-a669-4128-bf09-34cad49eac50 
I0201 20:56:20.921197       1 netScalerInterface.go:149] [DEBUG] GO-NITRO: response Status:404 Not Found
I0201 20:56:20.921466       1 netScalerInterface.go:430] [DEBUG] GO-NITRO: read: Device Config not found
I0201 20:56:20.921479       1 netScalerInterface.go:375] [INFO] GO-NITRO: vxlan resource not present on Device.
I0201 20:56:20.921569       1 netScalerInterface.go:175] [TRACE] GO-NITRO: Resourcejson is {"vxlan":{"id":20,"port":8500}}
I0201 20:56:20.921574       1 netScalerInterface.go:154] [DEBUG] GO-NITRO: Creating resource of type vxlan
I0201 20:56:20.921578       1 netScalerInterface.go:161] [TRACE] GO-NITRO: url is https://10.2.0.254/nitro/v1/config/vxlan
I0201 20:56:21.054676       1 create.go:284] [INFO] Updated node label Node-e7f386e3-a669-4128-bf09-34cad49eac50
I0201 20:56:21.054698       1 create.go:341] [INFO] Cleaning stale pods created by kube-cnc-router with pod name kube-cnc-router-e7f386e3-a669-4128-bf09-34cad49eac50
I0201 20:56:21.293890       1 netScalerInterface.go:149] [DEBUG] GO-NITRO: response Status:201 Created
I0201 20:56:21.293945       1 netScalerInterface.go:175] [TRACE] GO-NITRO: Resourcejson is {"vxlan_srcip_binding":{"id":20,"srcip":"10.1.0.254"}}
I0201 20:56:21.293950       1 netScalerInterface.go:154] [DEBUG] GO-NITRO: Creating resource of type vxlan_srcip_binding
I0201 20:56:21.293953       1 netScalerInterface.go:161] [TRACE] GO-NITRO: url is https://10.2.0.254/nitro/v1/config/vxlan_srcip_binding
I0201 20:56:21.406444       1 netScalerInterface.go:149] [DEBUG] GO-NITRO: response Status:201 Created
I0201 20:56:21.406494       1 netScalerInterface.go:175] [TRACE] GO-NITRO: Resourcejson is {"vxlan_nsip_binding":{"id":20,"ipaddress":"10.240.0.254","netmask":"255.255.255.0"}}
I0201 20:56:21.406500       1 netScalerInterface.go:154] [DEBUG] GO-NITRO: Creating resource of type vxlan_nsip_binding
I0201 20:56:21.406506       1 netScalerInterface.go:161] [TRACE] GO-NITRO: url is https://10.2.0.254/nitro/v1/config/vxlan_nsip_binding
I0201 20:56:21.443925       1 create.go:354] [INFO] Creating a pod kube-cnc-router-e7f386e3-a669-4128-bf09-34cad49eac50
I0201 20:56:21.516869       1 netScalerInterface.go:149] [DEBUG] GO-NITRO: response Status:201 Created
I0201 20:56:21.516897       1 k8sInterface.go:151] [INFO] CONFIG MAP ADD EVENT 
I0201 20:56:21.516901       1 netScalerInterface.go:259] [INFO] Adding SNIP Config
I0201 20:56:21.516905       1 netScalerInterface.go:413] [DEBUG] GO-NITRO: listing resource of type nsip, args:[ipaddress:10.240.0.254]
I0201 20:56:21.516913       1 netScalerInterface.go:419] [TRACE] GO-NITRO: url is https://10.2.0.254/nitro/v1/config/nsip?args=ipaddress:10.240.0.254
I0201 20:56:21.627006       1 netScalerInterface.go:149] [DEBUG] GO-NITRO: response Status:200 OK
I0201 20:56:21.627080       1 netScalerInterface.go:264] [INFO] SNIP already exists
I0201 20:56:21.627088       1 netScalerInterface.go:221] [INFO] Adding Vxlan Config
I0201 20:56:21.627090       1 netScalerInterface.go:223] [DEBUG] Removing if same Vxlan present in ADC
I0201 20:56:21.627093       1 netScalerInterface.go:250] [INFO] Deleting VXLAN Config
I0201 20:56:21.627186       1 netScalerInterface.go:413] [DEBUG] GO-NITRO: listing resource of type vxlan, args:[id:20]
I0201 20:56:21.627199       1 netScalerInterface.go:419] [TRACE] GO-NITRO: url is https://10.2.0.254/nitro/v1/config/vxlan?args=id:20
I0201 20:56:21.650097       1 watch.go:47] [INFO] Received Node Add Event
I0201 20:56:21.650346       1 create.go:270] [INFO] In CreateKubeExtenderPod
I0201 20:56:21.650361       1 create.go:279] [INFO] Generating PODCIDR for Node with label used is Node-00e50d1a-f709-4538-b247-17dcc6526a60 
I0201 20:56:21.742416       1 netScalerInterface.go:149] [DEBUG] GO-NITRO: response Status:200 OK
I0201 20:56:21.742576       1 netScalerInterface.go:368] [INFO] GO-NITRO: DeleteResource found resource of type vxlan
I0201 20:56:21.742586       1 netScalerInterface.go:381] [DEBUG] GO-NITRO: Deleting resource of type vxlan with args [id:20]
I0201 20:56:21.742593       1 netScalerInterface.go:385] [TRACE] GO-NITRO: url is https://10.2.0.254/nitro/v1/config/vxlan?args=id:20
I0201 20:56:21.848922       1 netScalerInterface.go:149] [DEBUG] GO-NITRO: response Status:200 OK
I0201 20:56:21.848979       1 netScalerInterface.go:175] [TRACE] GO-NITRO: Resourcejson is {"vxlan":{"id":20,"port":8500}}
I0201 20:56:21.848985       1 netScalerInterface.go:154] [DEBUG] GO-NITRO: Creating resource of type vxlan
I0201 20:56:21.848988       1 netScalerInterface.go:161] [TRACE] GO-NITRO: url is https://10.2.0.254/nitro/v1/config/vxlan
I0201 20:56:21.851819       1 create.go:284] [INFO] Updated node label Node-00e50d1a-f709-4538-b247-17dcc6526a60
I0201 20:56:21.851839       1 create.go:341] [INFO] Cleaning stale pods created by kube-cnc-router with pod name kube-cnc-router-00e50d1a-f709-4538-b247-17dcc6526a60
I0201 20:56:21.960042       1 netScalerInterface.go:149] [DEBUG] GO-NITRO: response Status:201 Created
I0201 20:56:21.960234       1 netScalerInterface.go:175] [TRACE] GO-NITRO: Resourcejson is {"vxlan_srcip_binding":{"id":20,"srcip":"10.1.0.254"}}
I0201 20:56:21.960248       1 netScalerInterface.go:154] [DEBUG] GO-NITRO: Creating resource of type vxlan_srcip_binding
I0201 20:56:21.960255       1 netScalerInterface.go:161] [TRACE] GO-NITRO: url is https://10.2.0.254/nitro/v1/config/vxlan_srcip_binding
I0201 20:56:22.066381       1 netScalerInterface.go:149] [DEBUG] GO-NITRO: response Status:201 Created
I0201 20:56:22.066413       1 netScalerInterface.go:175] [TRACE] GO-NITRO: Resourcejson is {"vxlan_nsip_binding":{"id":20,"ipaddress":"10.240.0.254","netmask":"255.255.255.0"}}
I0201 20:56:22.066421       1 netScalerInterface.go:154] [DEBUG] GO-NITRO: Creating resource of type vxlan_nsip_binding
I0201 20:56:22.066425       1 netScalerInterface.go:161] [TRACE] GO-NITRO: url is https://10.2.0.254/nitro/v1/config/vxlan_nsip_binding
I0201 20:56:22.171716       1 netScalerInterface.go:149] [DEBUG] GO-NITRO: response Status:201 Created
I0201 20:56:22.171741       1 k8sInterface.go:158] [INFO] Key Node-10.1.0.43 Value 10.1.0.43
I0201 20:56:22.171749       1 k8sInterface.go:165] [INFO] Host Route Iterface IP: 10.240.0.3 Mac: b2:3c:bf:8d:39:bc CNI-Route 10.244.3.71/24
I0201 20:56:22.171755       1 netScalerInterface.go:287] [INFO] Adding Route and Arp Config
I0201 20:56:22.171761       1 netScalerInterface.go:298] [INFO] Removing if same Network and Netmask present in NS
I0201 20:56:22.171764       1 netScalerInterface.go:305] [INFO] Deleting Route and Arp Config
I0201 20:56:22.171770       1 netScalerInterface.go:413] [DEBUG] GO-NITRO: listing resource of type route, args:[network:10.244.3.71 netmask:255.255.255.0]
I0201 20:56:22.171927       1 netScalerInterface.go:419] [TRACE] GO-NITRO: url is https://10.2.0.254/nitro/v1/config/route?args=network:10.244.3.71,netmask:255.255.255.0
I0201 20:56:22.241869       1 create.go:354] [INFO] Creating a pod kube-cnc-router-00e50d1a-f709-4538-b247-17dcc6526a60
I0201 20:56:22.278642       1 netScalerInterface.go:149] [DEBUG] GO-NITRO: response Status:404 Not Found
I0201 20:56:22.278698       1 netScalerInterface.go:430] [DEBUG] GO-NITRO: read: Device Config not found
I0201 20:56:22.278705       1 netScalerInterface.go:375] [INFO] GO-NITRO: route resource not present on Device.
I0201 20:56:22.278743       1 netScalerInterface.go:175] [TRACE] GO-NITRO: Resourcejson is {"route":{"network":"10.244.3.71","gateway":"10.240.0.3","netmask":"255.255.255.0"}}
I0201 20:56:22.278748       1 netScalerInterface.go:154] [DEBUG] GO-NITRO: Creating resource of type route
I0201 20:56:22.278756       1 netScalerInterface.go:161] [TRACE] GO-NITRO: url is https://10.2.0.254/nitro/v1/config/route
I0201 20:56:22.386252       1 netScalerInterface.go:149] [DEBUG] GO-NITRO: response Status:201 Created
I0201 20:56:22.386279       1 netScalerInterface.go:315] [INFO] Adding BridgeTable Config
I0201 20:56:22.386399       1 netScalerInterface.go:175] [TRACE] GO-NITRO: Resourcejson is {"bridgetable":{"mac":"00:00:00:00:00:00","vxlan":"20","vtep":"10.1.0.43"}}
I0201 20:56:22.386456       1 netScalerInterface.go:154] [DEBUG] GO-NITRO: Creating resource of type bridgetable
I0201 20:56:22.386486       1 netScalerInterface.go:161] [TRACE] GO-NITRO: url is https://10.2.0.254/nitro/v1/config/bridgetable
I0201 20:56:22.449960       1 watch.go:47] [INFO] Received Node Add Event
I0201 20:56:22.450934       1 create.go:270] [INFO] In CreateKubeExtenderPod
I0201 20:56:22.451024       1 create.go:279] [INFO] Generating PODCIDR for Node with label used is Node-adcb8ef1-fbe8-40ed-bcc6-0115a973b2f0 
I0201 20:56:22.506352       1 netScalerInterface.go:149] [DEBUG] GO-NITRO: response Status:403 Forbidden
I0201 20:56:22.506396       1 netScalerInterface.go:109] [INFO] GO-NITRO: Response = { "errorcode": 2138, "message": "Not authorized to execute this command [add bridgetable -mac 00:00:00:00:00:00 -vxlan 20 -vtep 10.1.0.43]", "severity": "ERROR" }
E0201 20:56:22.506411       1 netScalerInterface.go:206] [ERROR] Result   err [ERROR] GO-NITRO: Failed to create resource of type bridgetable, name=ADD, err=failed: 403 Forbidden ({ "errorcode": 2138, "message": "Not authorized to execute this command [add bridgetable -mac 00:00:00:00:00:00 -vxlan 20 -vtep 10.1.0.43]", "severity": "ERROR" })
I0201 20:56:22.506418       1 k8sInterface.go:158] [INFO] Key Node-10.1.0.41 Value 10.1.0.41
I0201 20:56:22.506427       1 k8sInterface.go:165] [INFO] Host Route Iterface IP: 10.240.0.3 Mac: 7e:ed:32:d5:ea:72 CNI-Route 10.244.1.168/24
I0201 20:56:22.506432       1 netScalerInterface.go:287] [INFO] Adding Route and Arp Config
I0201 20:56:22.506437       1 netScalerInterface.go:298] [INFO] Removing if same Network and Netmask present in NS
I0201 20:56:22.506441       1 netScalerInterface.go:305] [INFO] Deleting Route and Arp Config
I0201 20:56:22.506446       1 netScalerInterface.go:413] [DEBUG] GO-NITRO: listing resource of type route, args:[network:10.244.1.168 netmask:255.255.255.0]
I0201 20:56:22.506453       1 netScalerInterface.go:419] [TRACE] GO-NITRO: url is https://10.2.0.254/nitro/v1/config/route?args=network:10.244.1.168,netmask:255.255.255.0
I0201 20:56:22.647099       1 netScalerInterface.go:149] [DEBUG] GO-NITRO: response Status:404 Not Found
I0201 20:56:22.647175       1 netScalerInterface.go:430] [DEBUG] GO-NITRO: read: Device Config not found
I0201 20:56:22.647185       1 netScalerInterface.go:375] [INFO] GO-NITRO: route resource not present on Device.
I0201 20:56:22.647206       1 netScalerInterface.go:175] [TRACE] GO-NITRO: Resourcejson is {"route":{"network":"10.244.1.168","gateway":"10.240.0.3","netmask":"255.255.255.0"}}
I0201 20:56:22.647209       1 netScalerInterface.go:154] [DEBUG] GO-NITRO: Creating resource of type route
I0201 20:56:22.647212       1 netScalerInterface.go:161] [TRACE] GO-NITRO: url is https://10.2.0.254/nitro/v1/config/route
I0201 20:56:22.653977       1 create.go:284] [INFO] Updated node label Node-adcb8ef1-fbe8-40ed-bcc6-0115a973b2f0
I0201 20:56:22.654001       1 create.go:341] [INFO] Cleaning stale pods created by kube-cnc-router with pod name kube-cnc-router-adcb8ef1-fbe8-40ed-bcc6-0115a973b2f0
I0201 20:56:22.755136       1 netScalerInterface.go:149] [DEBUG] GO-NITRO: response Status:201 Created
I0201 20:56:22.755155       1 netScalerInterface.go:315] [INFO] Adding BridgeTable Config
I0201 20:56:22.755176       1 netScalerInterface.go:175] [TRACE] GO-NITRO: Resourcejson is {"bridgetable":{"mac":"00:00:00:00:00:00","vxlan":"20","vtep":"10.1.0.41"}}
I0201 20:56:22.755179       1 netScalerInterface.go:154] [DEBUG] GO-NITRO: Creating resource of type bridgetable
I0201 20:56:22.755183       1 netScalerInterface.go:161] [TRACE] GO-NITRO: url is https://10.2.0.254/nitro/v1/config/bridgetable
I0201 20:56:22.862238       1 netScalerInterface.go:149] [DEBUG] GO-NITRO: response Status:403 Forbidden
I0201 20:56:22.862273       1 netScalerInterface.go:109] [INFO] GO-NITRO: Response = { "errorcode": 2138, "message": "Not authorized to execute this command [add bridgetable -mac 00:00:00:00:00:00 -vxlan 20 -vtep 10.1.0.41]", "severity": "ERROR" }
E0201 20:56:22.862282       1 netScalerInterface.go:206] [ERROR] Result   err [ERROR] GO-NITRO: Failed to create resource of type bridgetable, name=ADD, err=failed: 403 Forbidden ({ "errorcode": 2138, "message": "Not authorized to execute this command [add bridgetable -mac 00:00:00:00:00:00 -vxlan 20 -vtep 10.1.0.41]", "severity": "ERROR" })
I0201 20:56:22.862289       1 k8sInterface.go:158] [INFO] Key Node-10.1.0.44 Value 10.1.0.44
I0201 20:56:22.862301       1 k8sInterface.go:165] [INFO] Host Route Iterface IP: 10.240.0.4 Mac: 66:b7:9a:55:9f:72 CNI-Route 10.244.4.179/24
I0201 20:56:22.862307       1 netScalerInterface.go:287] [INFO] Adding Route and Arp Config
I0201 20:56:22.862311       1 netScalerInterface.go:298] [INFO] Removing if same Network and Netmask present in NS
I0201 20:56:22.862315       1 netScalerInterface.go:305] [INFO] Deleting Route and Arp Config
I0201 20:56:22.862320       1 netScalerInterface.go:413] [DEBUG] GO-NITRO: listing resource of type route, args:[network:10.244.4.179 netmask:255.255.255.0]
I0201 20:56:22.862327       1 netScalerInterface.go:419] [TRACE] GO-NITRO: url is https://10.2.0.254/nitro/v1/config/route?args=network:10.244.4.179,netmask:255.255.255.0
I0201 20:56:22.968321       1 netScalerInterface.go:149] [DEBUG] GO-NITRO: response Status:404 Not Found
I0201 20:56:22.968384       1 netScalerInterface.go:430] [DEBUG] GO-NITRO: read: Device Config not found
I0201 20:56:22.968395       1 netScalerInterface.go:375] [INFO] GO-NITRO: route resource not present on Device.
I0201 20:56:22.968414       1 netScalerInterface.go:175] [TRACE] GO-NITRO: Resourcejson is {"route":{"network":"10.244.4.179","gateway":"10.240.0.4","netmask":"255.255.255.0"}}
I0201 20:56:22.968419       1 netScalerInterface.go:154] [DEBUG] GO-NITRO: Creating resource of type route
I0201 20:56:22.968422       1 netScalerInterface.go:161] [TRACE] GO-NITRO: url is https://10.2.0.254/nitro/v1/config/route
I0201 20:56:23.044832       1 create.go:354] [INFO] Creating a pod kube-cnc-router-adcb8ef1-fbe8-40ed-bcc6-0115a973b2f0
I0201 20:56:23.096684       1 netScalerInterface.go:149] [DEBUG] GO-NITRO: response Status:201 Created
I0201 20:56:23.096715       1 netScalerInterface.go:315] [INFO] Adding BridgeTable Config
I0201 20:56:23.096739       1 netScalerInterface.go:175] [TRACE] GO-NITRO: Resourcejson is {"bridgetable":{"mac":"00:00:00:00:00:00","vxlan":"20","vtep":"10.1.0.44"}}
I0201 20:56:23.096745       1 netScalerInterface.go:154] [DEBUG] GO-NITRO: Creating resource of type bridgetable
I0201 20:56:23.096749       1 netScalerInterface.go:161] [TRACE] GO-NITRO: url is https://10.2.0.254/nitro/v1/config/bridgetable
I0201 20:56:23.217815       1 netScalerInterface.go:149] [DEBUG] GO-NITRO: response Status:403 Forbidden
I0201 20:56:23.217865       1 netScalerInterface.go:109] [INFO] GO-NITRO: Response = { "errorcode": 2138, "message": "Not authorized to execute this command [add bridgetable -mac 00:00:00:00:00:00 -vxlan 20 -vtep 10.1.0.44]", "severity": "ERROR" }
E0201 20:56:23.217886       1 netScalerInterface.go:206] [ERROR] Result   err [ERROR] GO-NITRO: Failed to create resource of type bridgetable, name=ADD, err=failed: 403 Forbidden ({ "errorcode": 2138, "message": "Not authorized to execute this command [add bridgetable -mac 00:00:00:00:00:00 -vxlan 20 -vtep 10.1.0.44]", "severity": "ERROR" })
I0201 20:56:23.217894       1 k8sInterface.go:158] [INFO] Key Node-10.1.0.42 Value 10.1.0.42
I0201 20:56:23.217902       1 k8sInterface.go:165] [INFO] Host Route Iterface IP: 10.240.0.4 Mac: 8a:8c:59:a6:f6:b3 CNI-Route 10.244.5.26/24
I0201 20:56:23.217907       1 netScalerInterface.go:287] [INFO] Adding Route and Arp Config
I0201 20:56:23.217912       1 netScalerInterface.go:298] [INFO] Removing if same Network and Netmask present in NS
I0201 20:56:23.217915       1 netScalerInterface.go:305] [INFO] Deleting Route and Arp Config
I0201 20:56:23.217920       1 netScalerInterface.go:413] [DEBUG] GO-NITRO: listing resource of type route, args:[network:10.244.5.26 netmask:255.255.255.0]
I0201 20:56:23.217926       1 netScalerInterface.go:419] [TRACE] GO-NITRO: url is https://10.2.0.254/nitro/v1/config/route?args=network:10.244.5.26,netmask:255.255.255.0
I0201 20:56:23.352174       1 netScalerInterface.go:149] [DEBUG] GO-NITRO: response Status:404 Not Found
I0201 20:56:23.352232       1 netScalerInterface.go:430] [DEBUG] GO-NITRO: read: Device Config not found
I0201 20:56:23.352240       1 netScalerInterface.go:375] [INFO] GO-NITRO: route resource not present on Device.
I0201 20:56:23.352258       1 netScalerInterface.go:175] [TRACE] GO-NITRO: Resourcejson is {"route":{"network":"10.244.5.26","gateway":"10.240.0.4","netmask":"255.255.255.0"}}
I0201 20:56:23.352261       1 netScalerInterface.go:154] [DEBUG] GO-NITRO: Creating resource of type route
I0201 20:56:23.352264       1 netScalerInterface.go:161] [TRACE] GO-NITRO: url is https://10.2.0.254/nitro/v1/config/route
I0201 20:56:23.780896       1 netScalerInterface.go:149] [DEBUG] GO-NITRO: response Status:201 Created
I0201 20:56:23.780985       1 netScalerInterface.go:315] [INFO] Adding BridgeTable Config
I0201 20:56:23.781034       1 netScalerInterface.go:175] [TRACE] GO-NITRO: Resourcejson is {"bridgetable":{"mac":"00:00:00:00:00:00","vxlan":"20","vtep":"10.1.0.42"}}
I0201 20:56:23.781084       1 netScalerInterface.go:154] [DEBUG] GO-NITRO: Creating resource of type bridgetable
I0201 20:56:23.781117       1 netScalerInterface.go:161] [TRACE] GO-NITRO: url is https://10.2.0.254/nitro/v1/config/bridgetable
I0201 20:56:24.238605       1 netScalerInterface.go:149] [DEBUG] GO-NITRO: response Status:403 Forbidden
I0201 20:56:24.238654       1 netScalerInterface.go:109] [INFO] GO-NITRO: Response = { "errorcode": 2138, "message": "Not authorized to execute this command [add bridgetable -mac 00:00:00:00:00:00 -vxlan 20 -vtep 10.1.0.42]", "severity": "ERROR" }
E0201 20:56:24.238669       1 netScalerInterface.go:206] [ERROR] Result   err [ERROR] GO-NITRO: Failed to create resource of type bridgetable, name=ADD, err=failed: 403 Forbidden ({ "errorcode": 2138, "message": "Not authorized to execute this command [add bridgetable -mac 00:00:00:00:00:00 -vxlan 20 -vtep 10.1.0.42]", "severity": "ERROR" })
I0201 20:56:24.239122       1 k8sInterface.go:102] [INFO] CONFIG MAP UPDATE EVENT: Adding new config
I0201 20:56:24.239131       1 k8sInterface.go:103] [INFO] Key Node-10.1.0.43 Value 10.1.0.43
I0201 20:56:24.239136       1 k8sInterface.go:110] [INFO] Host Route Iterface IP: 10.240.0.3 Mac: 9e:37:d2:13:5c:fc CNI-Route 10.244.3.4/24
I0201 20:56:24.239141       1 netScalerInterface.go:287] [INFO] Adding Route and Arp Config
I0201 20:56:24.239146       1 netScalerInterface.go:298] [INFO] Removing if same Network and Netmask present in NS
I0201 20:56:24.239148       1 netScalerInterface.go:305] [INFO] Deleting Route and Arp Config
I0201 20:56:24.239153       1 netScalerInterface.go:413] [DEBUG] GO-NITRO: listing resource of type route, args:[network:10.244.3.4 netmask:255.255.255.0]
I0201 20:56:24.239159       1 netScalerInterface.go:419] [TRACE] GO-NITRO: url is https://10.2.0.254/nitro/v1/config/route?args=network:10.244.3.4,netmask:255.255.255.0
I0201 20:56:24.345424       1 netScalerInterface.go:149] [DEBUG] GO-NITRO: response Status:200 OK
I0201 20:56:24.345525       1 netScalerInterface.go:368] [INFO] GO-NITRO: DeleteResource found resource of type route
I0201 20:56:24.345542       1 netScalerInterface.go:381] [DEBUG] GO-NITRO: Deleting resource of type route with args [netmask:255.255.255.0 network:10.244.3.4]
I0201 20:56:24.345551       1 netScalerInterface.go:385] [TRACE] GO-NITRO: url is https://10.2.0.254/nitro/v1/config/route?args=netmask:255.255.255.0,network:10.244.3.4
I0201 20:56:24.772716       1 netScalerInterface.go:149] [DEBUG] GO-NITRO: response Status:200 OK
I0201 20:56:24.772776       1 netScalerInterface.go:175] [TRACE] GO-NITRO: Resourcejson is {"route":{"network":"10.244.3.4","gateway":"10.240.0.3","netmask":"255.255.255.0"}}
I0201 20:56:24.772781       1 netScalerInterface.go:154] [DEBUG] GO-NITRO: Creating resource of type route
I0201 20:56:24.772784       1 netScalerInterface.go:161] [TRACE] GO-NITRO: url is https://10.2.0.254/nitro/v1/config/route
I0201 20:56:25.227762       1 netScalerInterface.go:149] [DEBUG] GO-NITRO: response Status:201 Created
I0201 20:56:25.227779       1 netScalerInterface.go:315] [INFO] Adding BridgeTable Config
I0201 20:56:25.227800       1 netScalerInterface.go:175] [TRACE] GO-NITRO: Resourcejson is {"bridgetable":{"mac":"00:00:00:00:00:00","vxlan":"20","vtep":"10.1.0.43"}}
I0201 20:56:25.227804       1 netScalerInterface.go:154] [DEBUG] GO-NITRO: Creating resource of type bridgetable
I0201 20:56:25.227808       1 netScalerInterface.go:161] [TRACE] GO-NITRO: url is https://10.2.0.254/nitro/v1/config/bridgetable
I0201 20:56:25.333888       1 netScalerInterface.go:149] [DEBUG] GO-NITRO: response Status:403 Forbidden
I0201 20:56:25.333978       1 netScalerInterface.go:109] [INFO] GO-NITRO: Response = { "errorcode": 2138, "message": "Not authorized to execute this command [add bridgetable -mac 00:00:00:00:00:00 -vxlan 20 -vtep 10.1.0.43]", "severity": "ERROR" }
E0201 20:56:25.333997       1 netScalerInterface.go:206] [ERROR] Result   err [ERROR] GO-NITRO: Failed to create resource of type bridgetable, name=ADD, err=failed: 403 Forbidden ({ "errorcode": 2138, "message": "Not authorized to execute this command [add bridgetable -mac 00:00:00:00:00:00 -vxlan 20 -vtep 10.1.0.43]", "severity": "ERROR" })
I0201 20:56:25.334359       1 k8sInterface.go:102] [INFO] CONFIG MAP UPDATE EVENT: Adding new config
I0201 20:56:25.334372       1 k8sInterface.go:103] [INFO] Key Node-10.1.0.44 Value 10.1.0.44
I0201 20:56:25.334377       1 k8sInterface.go:110] [INFO] Host Route Iterface IP: 10.240.0.4 Mac: 72:d1:73:c6:9b:75 CNI-Route 10.244.4.253/24
I0201 20:56:25.334383       1 netScalerInterface.go:287] [INFO] Adding Route and Arp Config
I0201 20:56:25.334387       1 netScalerInterface.go:298] [INFO] Removing if same Network and Netmask present in NS
I0201 20:56:25.334391       1 netScalerInterface.go:305] [INFO] Deleting Route and Arp Config
I0201 20:56:25.334396       1 netScalerInterface.go:413] [DEBUG] GO-NITRO: listing resource of type route, args:[netmask:255.255.255.0 network:10.244.4.253]
I0201 20:56:25.334407       1 netScalerInterface.go:419] [TRACE] GO-NITRO: url is https://10.2.0.254/nitro/v1/config/route?args=netmask:255.255.255.0,network:10.244.4.253
I0201 20:56:25.441244       1 netScalerInterface.go:149] [DEBUG] GO-NITRO: response Status:200 OK
I0201 20:56:25.441303       1 netScalerInterface.go:368] [INFO] GO-NITRO: DeleteResource found resource of type route
I0201 20:56:25.441312       1 netScalerInterface.go:381] [DEBUG] GO-NITRO: Deleting resource of type route with args [network:10.244.4.253 netmask:255.255.255.0]
I0201 20:56:25.441319       1 netScalerInterface.go:385] [TRACE] GO-NITRO: url is https://10.2.0.254/nitro/v1/config/route?args=network:10.244.4.253,netmask:255.255.255.0
I0201 20:56:25.547650       1 netScalerInterface.go:149] [DEBUG] GO-NITRO: response Status:200 OK
I0201 20:56:25.547721       1 netScalerInterface.go:175] [TRACE] GO-NITRO: Resourcejson is {"route":{"network":"10.244.4.253","gateway":"10.240.0.4","netmask":"255.255.255.0"}}
I0201 20:56:25.547727       1 netScalerInterface.go:154] [DEBUG] GO-NITRO: Creating resource of type route
I0201 20:56:25.547732       1 netScalerInterface.go:161] [TRACE] GO-NITRO: url is https://10.2.0.254/nitro/v1/config/route
I0201 20:56:25.654812       1 netScalerInterface.go:149] [DEBUG] GO-NITRO: response Status:201 Created
I0201 20:56:25.654832       1 netScalerInterface.go:315] [INFO] Adding BridgeTable Config
I0201 20:56:25.654874       1 netScalerInterface.go:175] [TRACE] GO-NITRO: Resourcejson is {"bridgetable":{"mac":"00:00:00:00:00:00","vxlan":"20","vtep":"10.1.0.44"}}
I0201 20:56:25.654879       1 netScalerInterface.go:154] [DEBUG] GO-NITRO: Creating resource of type bridgetable
I0201 20:56:25.654884       1 netScalerInterface.go:161] [TRACE] GO-NITRO: url is https://10.2.0.254/nitro/v1/config/bridgetable
I0201 20:56:25.773468       1 netScalerInterface.go:149] [DEBUG] GO-NITRO: response Status:403 Forbidden
I0201 20:56:25.773510       1 netScalerInterface.go:109] [INFO] GO-NITRO: Response = { "errorcode": 2138, "message": "Not authorized to execute this command [add bridgetable -mac 00:00:00:00:00:00 -vxlan 20 -vtep 10.1.0.44]", "severity": "ERROR" }
E0201 20:56:25.773537       1 netScalerInterface.go:206] [ERROR] Result   err [ERROR] GO-NITRO: Failed to create resource of type bridgetable, name=ADD, err=failed: 403 Forbidden ({ "errorcode": 2138, "message": "Not authorized to execute this command [add bridgetable -mac 00:00:00:00:00:00 -vxlan 20 -vtep 10.1.0.44]", "severity": "ERROR" })
I0201 20:56:42.215186       1 k8sInterface.go:102] [INFO] CONFIG MAP UPDATE EVENT: Adding new config
I0201 20:56:42.215242       1 k8sInterface.go:103] [INFO] Key Node-10.1.0.42 Value 10.1.0.42
I0201 20:56:42.215251       1 k8sInterface.go:110] [INFO] Host Route Iterface IP: 10.240.0.2 Mac: 3a:bb:31:c3:6d:bf CNI-Route 10.244.5.192/24
I0201 20:56:42.215256       1 netScalerInterface.go:287] [INFO] Adding Route and Arp Config
I0201 20:56:42.215261       1 netScalerInterface.go:298] [INFO] Removing if same Network and Netmask present in NS
I0201 20:56:42.215264       1 netScalerInterface.go:305] [INFO] Deleting Route and Arp Config
I0201 20:56:42.215269       1 netScalerInterface.go:413] [DEBUG] GO-NITRO: listing resource of type route, args:[netmask:255.255.255.0 network:10.244.5.192]
I0201 20:56:42.215279       1 netScalerInterface.go:419] [TRACE] GO-NITRO: url is https://10.2.0.254/nitro/v1/config/route?args=netmask:255.255.255.0,network:10.244.5.192
I0201 20:56:42.329660       1 netScalerInterface.go:149] [DEBUG] GO-NITRO: response Status:200 OK
I0201 20:56:42.329748       1 netScalerInterface.go:368] [INFO] GO-NITRO: DeleteResource found resource of type route
I0201 20:56:42.329758       1 netScalerInterface.go:381] [DEBUG] GO-NITRO: Deleting resource of type route with args [netmask:255.255.255.0 network:10.244.5.192]
I0201 20:56:42.329768       1 netScalerInterface.go:385] [TRACE] GO-NITRO: url is https://10.2.0.254/nitro/v1/config/route?args=netmask:255.255.255.0,network:10.244.5.192
I0201 20:56:42.438507       1 netScalerInterface.go:149] [DEBUG] GO-NITRO: response Status:200 OK
I0201 20:56:42.438570       1 netScalerInterface.go:175] [TRACE] GO-NITRO: Resourcejson is {"route":{"network":"10.244.5.192","gateway":"10.240.0.2","netmask":"255.255.255.0"}}
I0201 20:56:42.438580       1 netScalerInterface.go:154] [DEBUG] GO-NITRO: Creating resource of type route
I0201 20:56:42.438584       1 netScalerInterface.go:161] [TRACE] GO-NITRO: url is https://10.2.0.254/nitro/v1/config/route
I0201 20:56:42.545654       1 netScalerInterface.go:149] [DEBUG] GO-NITRO: response Status:201 Created
I0201 20:56:42.545678       1 netScalerInterface.go:315] [INFO] Adding BridgeTable Config
I0201 20:56:42.545704       1 netScalerInterface.go:175] [TRACE] GO-NITRO: Resourcejson is {"bridgetable":{"mac":"00:00:00:00:00:00","vxlan":"20","vtep":"10.1.0.42"}}
I0201 20:56:42.545707       1 netScalerInterface.go:154] [DEBUG] GO-NITRO: Creating resource of type bridgetable
I0201 20:56:42.545713       1 netScalerInterface.go:161] [TRACE] GO-NITRO: url is https://10.2.0.254/nitro/v1/config/bridgetable
I0201 20:56:42.652313       1 netScalerInterface.go:149] [DEBUG] GO-NITRO: response Status:403 Forbidden
I0201 20:56:42.652349       1 netScalerInterface.go:109] [INFO] GO-NITRO: Response = { "errorcode": 2138, "message": "Not authorized to execute this command [add bridgetable -mac 00:00:00:00:00:00 -vxlan 20 -vtep 10.1.0.42]", "severity": "ERROR" }
E0201 20:56:42.652360       1 netScalerInterface.go:206] [ERROR] Result   err [ERROR] GO-NITRO: Failed to create resource of type bridgetable, name=ADD, err=failed: 403 Forbidden ({ "errorcode": 2138, "message": "Not authorized to execute this command [add bridgetable -mac 00:00:00:00:00:00 -vxlan 20 -vtep 10.1.0.42]", "severity": "ERROR" })
I0201 20:56:53.259687       1 create.go:270] [INFO] In CreateKubeExtenderPod
I0201 20:56:53.259775       1 create.go:279] [INFO] Generating PODCIDR for Node with label used is Node-1596548f-7f27-4534-be75-735b8895bba4 
I0201 20:56:53.272658       1 create.go:284] [INFO] Updated node label Node-1596548f-7f27-4534-be75-735b8895bba4
I0201 20:56:53.272730       1 create.go:341] [INFO] Cleaning stale pods created by kube-cnc-router with pod name kube-cnc-router-1596548f-7f27-4534-be75-735b8895bba4
I0201 20:56:53.320519       1 create.go:354] [INFO] Creating a pod kube-cnc-router-1596548f-7f27-4534-be75-735b8895bba4
I0201 20:57:02.345758       1 k8sInterface.go:102] [INFO] CONFIG MAP UPDATE EVENT: Adding new config
I0201 20:57:02.345775       1 k8sInterface.go:103] [INFO] Key Node-10.1.0.41 Value 10.1.0.41
I0201 20:57:02.345780       1 k8sInterface.go:110] [INFO] Host Route Iterface IP: 10.240.0.5 Mac: ca:75:10:ef:8b:99 CNI-Route 10.244.1.54
E0201 20:57:02.345785       1 k8sInterface.go:115] [ERROR] Could not fetch Network, need enhancements[10.244.1.54]
I0201 20:57:02.345792       1 netScalerInterface.go:287] [INFO] Adding Route and Arp Config
I0201 20:57:02.345797       1 netScalerInterface.go:298] [INFO] Removing if same Network and Netmask present in NS
I0201 20:57:02.345799       1 netScalerInterface.go:305] [INFO] Deleting Route and Arp Config
I0201 20:57:02.345808       1 netScalerInterface.go:413] [DEBUG] GO-NITRO: listing resource of type route, args:[network: netmask:0.0.0.0]
I0201 20:57:02.345813       1 netScalerInterface.go:419] [TRACE] GO-NITRO: url is https://10.2.0.254/nitro/v1/config/route?args=network:,netmask:0.0.0.0
I0201 20:57:02.360315       1 netScalerInterface.go:149] [DEBUG] GO-NITRO: response Status:599 Netscaler specific error
I0201 20:57:02.360357       1 netScalerInterface.go:436] [INFO] GO-NITRO: read: Response = {"errorcode":-1,"message":"Invalid args in query parameters","severity":"ERROR"}
I0201 20:57:02.360365       1 netScalerInterface.go:375] [INFO] GO-NITRO: route resource not present on Device.
I0201 20:57:02.360381       1 netScalerInterface.go:175] [TRACE] GO-NITRO: Resourcejson is {"route":{"gateway":"10.240.0.5","netmask":"0.0.0.0"}}
I0201 20:57:02.360384       1 netScalerInterface.go:154] [DEBUG] GO-NITRO: Creating resource of type route
I0201 20:57:02.360387       1 netScalerInterface.go:161] [TRACE] GO-NITRO: url is https://10.2.0.254/nitro/v1/config/route
I0201 20:57:02.472264       1 netScalerInterface.go:149] [DEBUG] GO-NITRO: response Status:400 Bad Request
I0201 20:57:02.472392       1 netScalerInterface.go:109] [INFO] GO-NITRO: Response = { "errorcode": 1095, "message": "Required argument missing [network]", "severity": "ERROR" }
E0201 20:57:02.472412       1 netScalerInterface.go:206] [ERROR] Result   err [ERROR] GO-NITRO: Failed to create resource of type route, name=ADD, err=failed: 400 Bad Request ({ "errorcode": 1095, "message": "Required argument missing [network]", "severity": "ERROR" })
I0201 20:57:02.472418       1 netScalerInterface.go:315] [INFO] Adding BridgeTable Config
I0201 20:57:02.472451       1 netScalerInterface.go:175] [TRACE] GO-NITRO: Resourcejson is {"bridgetable":{"mac":"00:00:00:00:00:00","vxlan":"20","vtep":"10.1.0.41"}}
I0201 20:57:02.472461       1 netScalerInterface.go:154] [DEBUG] GO-NITRO: Creating resource of type bridgetable
I0201 20:57:02.472467       1 netScalerInterface.go:161] [TRACE] GO-NITRO: url is https://10.2.0.254/nitro/v1/config/bridgetable
I0201 20:57:02.584441       1 netScalerInterface.go:149] [DEBUG] GO-NITRO: response Status:403 Forbidden
I0201 20:57:02.584491       1 netScalerInterface.go:109] [INFO] GO-NITRO: Response = { "errorcode": 2138, "message": "Not authorized to execute this command [add bridgetable -mac 00:00:00:00:00:00 -vxlan 20 -vtep 10.1.0.41]", "severity": "ERROR" }
E0201 20:57:02.584502       1 netScalerInterface.go:206] [ERROR] Result   err [ERROR] GO-NITRO: Failed to create resource of type bridgetable, name=ADD, err=failed: 403 Forbidden ({ "errorcode": 2138, "message": "Not authorized to execute this command [add bridgetable -mac 00:00:00:00:00:00 -vxlan 20 -vtep 10.1.0.41]", "severity": "ERROR" })


Will de-deploy and collect the rest later.

Thanks

**Comment by aroraharsh23** [comment]
Will update cmdpolicy in helm-chart repo to include bridgetable.

**Comment by chralg** [comment]
Great. 
Is this a valid mac-address for bridgetable? 
add bridgetable -mac 00:00:00:00:00:00 -vxlan 20 -vtep 10.1.0.43

**Comment by aroraharsh23** [comment]
Yes, nothing wrong

https://github.com/citrix/citrix-k8s-node-controller/blob/master/deploy/README.md

**Comment by chralg** [comment]
Ok. Thanks.

So i deleted the cnc-release (helm delete), removed clusterrole+binding from kube-system. Removed all/most config that CNC adds (e.g. vxlan, routes etc) to the ADC and rebooted all nodes to get rid of routervxlan0 interface. Then I updated the ADC user policy and re-installed CNC from Helm. This time, CNC clusterrole+binding in kube-system was created. Good.

When re-installing/upgrading CNC the deployment creates new routes to the ADC, and leaving the old behind. In a production environment this could cause som pain.

I have a test-cluster with 4 workers and 1 master. For some reason I now have vxlan troubles. I can't do stateful connections. Ping and UDP works, but no stateful.

Logs output

$ kubectl -n kube-system logs kube-cnc-router-00e50d1a-f709-4538-b247-17dcc6526a60 
CNI Name is cilium 
Cannot find device "routervxlan0"
Host Interface ens192
CNI Interface cilium_host
ip link add routervxlan0 type vxlan id 20  dev ens192  dstport 8500
ip addr add 10.240.0.3/24 dev routervxlan0
InterfaceInfo 4a:fe:6c:65:35:69
IP Addredd 10.240.0.3
Host IP Address 10.1.0.43
CNI IP Address 10.244.3.25
CNI IP Prefix /24
CNI Addr 10.244.3.25/24

So when investigated the _Cannot find device "routervxlan0"_ and I think this is because a missing routervxlan0 interface when script is trying to 'ip link delete routervxlan0', so routing stdout to null would benefit here :)

Also a typo made it through.  echo "IP Addredd ${theIPaddress}"

Will figure some more ...

**Comment by aroraharsh23** [comment]
> When re-installing/upgrading CNC the deployment creates new routes to the ADC, and leaving the old behind.

If the need is to remove all the old config before starting new one, no need to restart the CNC, just add (if not already applied) and remove the cnc configmap 
https://github.com/citrix/citrix-k8s-node-controller/tree/master/deploy#delete-the-citrix-k8s-node-controller

>   So when investigated the Cannot find device "routervxlan0" and I think this is because a missing routervxlan0 interface when script is trying to 'ip link delete routervxlan0', so routing stdout to null would benefit here :)

Yes, will update this.

> Also a typo made it through. echo "IP Addredd ${theIPaddress}"

Will correct.

> For some reason I now have vxlan troubles. I can't do stateful connections. Ping and UDP works, but no stateful.

Need clarity on this. Few things :
1) How are you testing connectivity? Accessing from ADC to pods/host  or some other way?
2) If you could dump your iptables rules (iptables -S)
3) Also, please share the current ADC config.

**Comment by chralg** [comment]
Hi.
I have monitors configured in CIC that fails when trying to connect to pod. Also curl from shell fails. I've verified with tcpdump in both ADC and node.


Netscaler dump (for some reason nstcpdump.sh doesn't include egress packet)

16:26:39.969801 IP 10.244.1.107.8080 > 10.240.0.254.22034: Flags [S.], seq 1334370663, ack 2097958987, win 64860, options [mss 1410,nop,nop,sackOK,nop,wscale 7], length 0



16:26:43.972394 IP 10.244.1.107.8080 > 10.240.0.254.14889: Flags [S.], seq 2397934132, ack 1646017110, win 64860, options [mss 1410,nop,nop,sackOK,nop,wscale 7], length 0
16:26:44.991433 IP 10.244.1.107.8080 > 10.240.0.254.14889: Flags [S.], seq 2397934132, ack 1646017110, win 64860, options [mss 1410,nop,nop,sackOK,nop,wscale 7], length 0
16:26:48.987200 IP 10.244.1.107.8080 > 10.240.0.254.19588: Flags [S.], seq 2324981749, ack 3051505032, win 64860, options [mss 1410,nop,nop,sackOK,nop,wscale 7], length 0
16:26:50.016388 IP 10.244.1.107.8080 > 10.240.0.254.19588: Flags [S.], seq 2324981749, ack 3051505032, win 64860, options [mss 1410,nop,nop,sackOK,nop,wscale 7], length 0


node dump

**Comment by chralg** [comment]
How do I verify the IPSEC part of the setup?

**Comment by aroraharsh23** [comment]
I tried reproducing the issue with your yamls, haven't been able to so far.

As you mentioned, "Also curl from shell fails." That means there could be some generic CNI/node-networking issue in your setup.

Regarding iptables, only IPtable rule(non-DSR case) that CNC configures is there:
-A INPUT -p udp -m udp --dport 8500 -j ACCEPT

Are you also applying DSR config as well ?
Are you able to do curl to your pods from master node ?

**Comment by chralg** [comment]
Hi,
I am trying to get the non-DSR setup going (vxlan etc.).
I was using curl from the ADC. I also tried to bind the monitor to a net-profile associated with the VXLAN IP even though traffic already sourced from that interface/IP.

Is the cnc pods supposed to be created on all nodes? In my setup it doesn't get applied to the master nodes, just workers.
Also, checking the bridge interface settings only Netscaler MAC addresses are added for ARP (and possibly BUM traffic)

# bridge fdb list dev routervxlan0
00:00:00:00:00:00 dst 10.1.0.254 self permanent
00:0c:29:bf:3b:56 dst 10.1.0.254 self 
00:0c:29:bf:3b:60 dst 10.1.0.254 self 
# 
My ADC's vxlan if is 10.240.0.254, but for some reason 
  # ip monitor neigh dev routervxlan0
10.240.0.254 lladdr 00:0c:29:bf:3b:60 REACHABLE
10.240.0.254 lladdr 00:0c:29:bf:3b:56 STALE
10.240.0.254 lladdr 00:0c:29:bf:3b:56 PROBE
10.240.0.254  FAILED
10.240.0.254 lladdr 00:0c:29:bf:3b:56 DELAY
10.240.0.254 lladdr 00:0c:29:bf:3b:56 PROBE
10.240.0.254  FAILED
10.240.0.254 lladdr 00:0c:29:bf:3b:60 REACHABLE

#ip -s -s -4 neigh show dev routervxlan0
10.240.0.254 lladdr 00:0c:29:bf:3b:60 ref 1 used 45/20/45 probes 4 REACHABLE
10.240.0.1  used 92060/92172/92059 probes 6 FAILED
10.240.0.4  used 114505/114567/114504 probes 6 FAILED

This looks OK given that the worker nodes's only supposed to see ADC through the VXLAN, but I am no expert in Linux vxlan networking. 

General connectivity outside VXLAN is made every now and then from the workers w/o problem.
GET /nitro/v1/stat/nsglobalcntr?args=counters:sys_cur_duration_sincestart HTTP/1.1\r\n

A frustrating thing is that ADC is able to correctly connect to the pod every 20 or 30 attempt.

What I've found is that ADC does SYN to the worker, and receive SYN,ACK but never ACK the packet back to worker. Instead worker's retransmitting the SYN,ACK packet with same result causing ADC to believe that TCP is OK, but application is timeout.

![image](https://user-images.githubusercontent.com/3530407/107378011-db0f3d80-6aeb-11eb-83ae-85d4ffe112b1.png)

I am starting to believe that this is a ADC bug, because a ns trace shows that packet's received correctly..
What ADC versions are supported?

> sh version
	NetScaler NS13.0: Build 71.44.nc, Date: Dec 26 2020, 11:31:14   (64-bit)
 Done
> 

Thanks

**Comment by aroraharsh23** [comment]
>Is the cnc pods supposed to be created on all nodes?

No, CNC router pods are only created on worker nodes.

As you told, that it works after some attempts, If you please provide the ns trace file with working and non-working case.
Also, if you could provide ADC Tech support bundle if possible.
And your CNC yaml.

**Comment by chralg** [comment]
How would you like these bundles? Is there a better way than attaching them to this thread?

Thanks

**Comment by chralg** [comment]
I have dug around some now. I configured the bridge on two workers in order to troubleshoot some more. For what I understand the problem still exists (no stateful connections are working) - this must be a Linux-bridge or perhaps Cilium issue.. 

I've tried to disable kernel filtering (iptables 's FORWARD chain defaults to DROP)
# iptables -S
-P INPUT ACCEPT
-P FORWARD DROP
-P OUTPUT ACCEPT
...
 # cd /proc/sys/net/bridge
 # ls
 bridge-nf-call-arptables  bridge-nf-call-iptables
 bridge-nf-call-ip6tables  bridge-nf-filter-vlan-tagged
 # for f in bridge-nf-*; do echo 0 > $f; done

but same problem. I guess Iptables need some more investigation. Anyway TCP is still a problem. ARP and ICMP works.

Thanks

**Comment by aroraharsh23** [comment]
We can ahead step by step. As you said earlier that you are able to receive the SYN-ACK on ADC and somehow ADC is not sending ACK back, so, we need to debug the issue there.

Please raise the issue in ADC customer support with the required bundle. And we can proceed from there.

**Comment by harora2325** [comment]
For this issue, is MBF enabled on your ADC? If yes, try once with disabling that.

**Comment by chralg** [comment]
Yes, I had MBF enabled - disabling that did allow NS to do a 3-way TCP.

Thanks
Chris

**Comment by aroraharsh23** [comment]
Could you upgrade ADC to latest 13.0 76.31 version, and confirm if the issue is still seen, even keeping MBF enabled.

**Comment by chralg** [comment]
I upgraded to latest 13.0 79.64 and now it works with MBF enabled.

Thanks
Christofer

**Comment by subashd** [comment]
@chralg thank you for confirming.
